{
  "benchmark_name": "balkanbench",
  "benchmark_version": "0.1.0",
  "run_type": "official",
  "task_id": "superglue.rte.mne",
  "language": "mne",
  "model": "crosloengual_bert",
  "model_id": "EMBEDDIA/crosloengual-bert",
  "model_revision": "unknown",
  "code_revision": "unknown",
  "dataset_revision": "v0.1.0-data",
  "image_digest": "sha256:local",
  "config_hash": "sha256:f06c504974db05085b48604d7944e48f30ae535839028ae61580ae954640f3d4",
  "selection_metric": "accuracy",
  "hp_search": {
    "tool": "optuna",
    "sampler": "TPESampler",
    "sampler_seed": 42,
    "num_trials": 20,
    "search_space_id": "default-binary_classification-v1",
    "early_stopping_policy": "patience=5 on accuracy",
    "best_trial_number": 13,
    "best_value": 0.6787003610108303,
    "sweep_id": "sweep-20260426-002806"
  },
  "seeds": [
    42,
    43,
    44,
    45,
    46
  ],
  "seed_results": [
    {
      "seed": 42,
      "primary": {
        "accuracy": 0.6506666666666666
      },
      "secondary": {}
    },
    {
      "seed": 43,
      "primary": {
        "accuracy": 0.6493333333333333
      },
      "secondary": {}
    },
    {
      "seed": 44,
      "primary": {
        "accuracy": 0.6556666666666666
      },
      "secondary": {}
    },
    {
      "seed": 45,
      "primary": {
        "accuracy": 0.6516666666666666
      },
      "secondary": {}
    },
    {
      "seed": 46,
      "primary": {
        "accuracy": 0.6556666666666666
      },
      "secondary": {}
    }
  ],
  "aggregate": {
    "mean": {
      "accuracy": 0.6526
    },
    "stdev": {
      "accuracy": 0.002919284539441501
    }
  },
  "task_score": 0.6526,
  "rankable": true,
  "test_predictions_hash": "sha256:71ade9bbdada6ee1d816196948329081c4f00ff6ee131c6d680fab68ec0beeb0",
  "sponsor": "Recrewty"
}