{
  "benchmark_name": "balkanbench",
  "benchmark_version": "0.1.0",
  "run_type": "official",
  "task_id": "superglue.cb.mne",
  "language": "mne",
  "model": "bertic",
  "model_id": "classla/bcms-bertic",
  "model_revision": "unknown",
  "code_revision": "unknown",
  "dataset_revision": "v0.1.0-data",
  "image_digest": "sha256:local",
  "config_hash": "sha256:08a68896283ac7418e65b7af9b1d095cd726615d8b722d65a7bad9320a1008b9",
  "selection_metric": "f1_macro",
  "hp_search": {
    "tool": "optuna",
    "sampler": "TPESampler",
    "sampler_seed": 42,
    "num_trials": 20,
    "search_space_id": "default-multiclass_classification-v1",
    "early_stopping_policy": "patience=10 on f1_macro",
    "best_trial_number": 13,
    "best_value": 0.8096200096200096,
    "sweep_id": "sweep-20260425-232455"
  },
  "seeds": [
    42,
    43,
    44,
    45,
    46
  ],
  "seed_results": [
    {
      "seed": 42,
      "primary": {
        "f1_macro": 0.8359452794503887
      },
      "secondary": {
        "accuracy": 0.88
      }
    },
    {
      "seed": 43,
      "primary": {
        "f1_macro": 0.7936654473165629
      },
      "secondary": {
        "accuracy": 0.852
      }
    },
    {
      "seed": 44,
      "primary": {
        "f1_macro": 0.7750916614729845
      },
      "secondary": {
        "accuracy": 0.844
      }
    },
    {
      "seed": 45,
      "primary": {
        "f1_macro": 0.7872774541095451
      },
      "secondary": {
        "accuracy": 0.868
      }
    },
    {
      "seed": 46,
      "primary": {
        "f1_macro": 0.8056747905438705
      },
      "secondary": {
        "accuracy": 0.864
      }
    }
  ],
  "aggregate": {
    "mean": {
      "f1_macro": 0.7995309265786703
    },
    "stdev": {
      "f1_macro": 0.023160209805400744
    }
  },
  "task_score": 0.7995309265786703,
  "rankable": true,
  "test_predictions_hash": "sha256:dab07b472d0bac3cf26ee84454f391e6e5400f58984e9581cc2c91f8cbdff9a0",
  "sponsor": "Recrewty"
}