{
  "benchmark_name": "balkanbench",
  "benchmark_version": "0.1.0",
  "run_type": "official",
  "task_id": "superglue.copa.hr",
  "language": "hr",
  "model": "crosloengual_bert",
  "model_id": "EMBEDDIA/crosloengual-bert",
  "model_revision": "unknown",
  "code_revision": "unknown",
  "dataset_revision": "v0.1.0-data",
  "image_digest": "sha256:local",
  "config_hash": "sha256:6f3b59f49156d617a62131e4dc9da1d23929c14056a97ca7a0879b71a41b5187",
  "selection_metric": "accuracy",
  "hp_search": {
    "tool": "optuna",
    "sampler": "TPESampler",
    "sampler_seed": 42,
    "num_trials": 20,
    "search_space_id": "default-multiple_choice-v1",
    "early_stopping_policy": "patience=10 on accuracy",
    "best_trial_number": 1,
    "best_value": 0.65,
    "sweep_id": "sweep-20260426-024632"
  },
  "seeds": [
    42,
    43,
    44,
    45,
    46
  ],
  "seed_results": [
    {
      "seed": 42,
      "primary": {
        "accuracy": 0.624
      },
      "secondary": {}
    },
    {
      "seed": 43,
      "primary": {
        "accuracy": 0.61
      },
      "secondary": {}
    },
    {
      "seed": 44,
      "primary": {
        "accuracy": 0.636
      },
      "secondary": {}
    },
    {
      "seed": 45,
      "primary": {
        "accuracy": 0.614
      },
      "secondary": {}
    },
    {
      "seed": 46,
      "primary": {
        "accuracy": 0.598
      },
      "secondary": {}
    }
  ],
  "aggregate": {
    "mean": {
      "accuracy": 0.6164
    },
    "stdev": {
      "accuracy": 0.014380542409798053
    }
  },
  "task_score": 0.6164,
  "rankable": true,
  "test_predictions_hash": "sha256:bd790af37af1df9e48fbb74c022c6bc9f10ed36010323de471bca406a68fdc18",
  "sponsor": "Recrewty"
}