{
  "benchmark_name": "balkanbench",
  "benchmark_version": "0.1.0",
  "run_type": "official",
  "task_id": "superglue.cb.hr",
  "language": "hr",
  "model": "galton_v3_base",
  "model_id": "permitt/galton-bcms-v3-base-ctx8192",
  "model_revision": "unknown",
  "code_revision": "unknown",
  "dataset_revision": "v0.1.0-data",
  "image_digest": "sha256:local",
  "config_hash": "sha256:635f98bc9b77413179ff3aa1b1abb943d1a803c3b0fc883a4fb0b70698fbfe86",
  "selection_metric": "f1_macro",
  "hp_search": {
    "tool": "optuna",
    "sampler": "TPESampler",
    "sampler_seed": 42,
    "num_trials": 20,
    "search_space_id": "default-multiclass_classification-v1",
    "early_stopping_policy": "patience=10 on f1_macro",
    "best_trial_number": 13,
    "best_value": 0.5106432748538011,
    "sweep_id": "sweep-20260426-003848"
  },
  "seeds": [
    42,
    43,
    44,
    45,
    46
  ],
  "seed_results": [
    {
      "seed": 42,
      "primary": {
        "f1_macro": 0.5541834585659288
      },
      "secondary": {
        "accuracy": 0.752
      }
    },
    {
      "seed": 43,
      "primary": {
        "f1_macro": 0.5012438662558485
      },
      "secondary": {
        "accuracy": 0.728
      }
    },
    {
      "seed": 44,
      "primary": {
        "f1_macro": 0.6475021340055865
      },
      "secondary": {
        "accuracy": 0.764
      }
    },
    {
      "seed": 45,
      "primary": {
        "f1_macro": 0.5498328177622804
      },
      "secondary": {
        "accuracy": 0.744
      }
    },
    {
      "seed": 46,
      "primary": {
        "f1_macro": 0.5062068965517241
      },
      "secondary": {
        "accuracy": 0.732
      }
    }
  ],
  "aggregate": {
    "mean": {
      "f1_macro": 0.5517938346282737
    },
    "stdev": {
      "f1_macro": 0.0587433032035521
    }
  },
  "task_score": 0.5517938346282737,
  "rankable": true,
  "test_predictions_hash": "sha256:feb4abfc283b02c516248ff242f7d3c02299bcb61b634d94650b677676fb926d",
  "sponsor": "Recrewty"
}