{
  "benchmark_name": "balkanbench",
  "benchmark_version": "0.1.0",
  "run_type": "official",
  "task_id": "superglue.copa.mne",
  "language": "mne",
  "model": "galton_v3_large",
  "model_id": "permitt/galton-bcms-v3-large-ctx8192",
  "model_revision": "unknown",
  "code_revision": "unknown",
  "dataset_revision": "v0.1.0-data",
  "image_digest": "sha256:local",
  "config_hash": "sha256:b10b112ae684fe0d7b0c49b05d2e1cb2e77b57b54f1940360d96d9d4c0f46aaa",
  "selection_metric": "accuracy",
  "hp_search": {
    "tool": "optuna",
    "sampler": "TPESampler",
    "sampler_seed": 42,
    "num_trials": 20,
    "search_space_id": "default-multiple_choice-v1",
    "early_stopping_policy": "patience=10 on accuracy",
    "best_trial_number": 10,
    "best_value": 0.77,
    "sweep_id": "sweep-20260426-034542"
  },
  "seeds": [
    42,
    43,
    44,
    45,
    46
  ],
  "seed_results": [
    {
      "seed": 42,
      "primary": {
        "accuracy": 0.774
      },
      "secondary": {}
    },
    {
      "seed": 43,
      "primary": {
        "accuracy": 0.786
      },
      "secondary": {}
    },
    {
      "seed": 44,
      "primary": {
        "accuracy": 0.762
      },
      "secondary": {}
    },
    {
      "seed": 45,
      "primary": {
        "accuracy": 0.764
      },
      "secondary": {}
    },
    {
      "seed": 46,
      "primary": {
        "accuracy": 0.752
      },
      "secondary": {}
    }
  ],
  "aggregate": {
    "mean": {
      "accuracy": 0.7676000000000001
    },
    "stdev": {
      "accuracy": 0.012915107432770363
    }
  },
  "task_score": 0.7676000000000001,
  "rankable": true,
  "test_predictions_hash": "sha256:25a4da254312815ff57846af822d787bff44af0da6f9b5b79d5a1bda288de1ec",
  "sponsor": "Recrewty"
}