{
  "benchmark_name": "balkanbench",
  "benchmark_version": "0.1.0",
  "run_type": "official",
  "task_id": "superglue.copa.mne",
  "language": "mne",
  "model": "bertic",
  "model_id": "classla/bcms-bertic",
  "model_revision": "unknown",
  "code_revision": "unknown",
  "dataset_revision": "v0.1.0-data",
  "image_digest": "sha256:local",
  "config_hash": "sha256:39fee7e3bbdaff61148653c3797dbd82b02605ed59e63153b328472d847adb2e",
  "selection_metric": "accuracy",
  "hp_search": {
    "tool": "optuna",
    "sampler": "TPESampler",
    "sampler_seed": 42,
    "num_trials": 20,
    "search_space_id": "default-multiple_choice-v1",
    "early_stopping_policy": "patience=10 on accuracy",
    "best_trial_number": 13,
    "best_value": 0.67,
    "sweep_id": "sweep-20260426-032616"
  },
  "seeds": [
    42,
    43,
    44,
    45,
    46
  ],
  "seed_results": [
    {
      "seed": 42,
      "primary": {
        "accuracy": 0.66
      },
      "secondary": {}
    },
    {
      "seed": 43,
      "primary": {
        "accuracy": 0.678
      },
      "secondary": {}
    },
    {
      "seed": 44,
      "primary": {
        "accuracy": 0.696
      },
      "secondary": {}
    },
    {
      "seed": 45,
      "primary": {
        "accuracy": 0.694
      },
      "secondary": {}
    },
    {
      "seed": 46,
      "primary": {
        "accuracy": 0.65
      },
      "secondary": {}
    }
  ],
  "aggregate": {
    "mean": {
      "accuracy": 0.6756
    },
    "stdev": {
      "accuracy": 0.02036663938896151
    }
  },
  "task_score": 0.6756,
  "rankable": true,
  "test_predictions_hash": "sha256:daafb056fa109f30f561f1e22b6fc519a4b43a55cc08d8b8a10cd613e555e0d3",
  "sponsor": "Recrewty"
}