{
  "benchmark_name": "balkanbench",
  "benchmark_version": "0.1.0",
  "run_type": "official",
  "task_id": "superglue.rte.sr",
  "language": "sr",
  "model": "mmbert",
  "model_display_name": "mmBERT",
  "model_id": "jhu-clsp/mmBERT-base",
  "params": 307000000,
  "model_revision": "launch-seed-v0.1.0",
  "code_revision": "feature-code-for-eval-launch-seed",
  "dataset_revision": "v0.1.0-data",
  "image_digest": "sha256:0000000000000000000000000000000000000000000000000000000000000000",
  "config_hash": "sha256:f0f945508dc7608d2c38deef50c7ed42e1a2c0f1c26c6ee3733a72a9b516760f",
  "selection_metric": "accuracy",
  "hp_search": {
    "tool": "optuna",
    "sampler": "TPESampler",
    "sampler_seed": 42,
    "num_trials": 0,
    "search_space_id": "v0.1-launch-seed",
    "early_stopping_policy": "reproduced from prior-pipeline aggregates; seeded for v0.1 launch, regenerated in v0.2 when all 9 models re-run through the public harness"
  },
  "seeds": [
    42,
    43,
    44,
    45,
    46
  ],
  "seed_results": [
    {
      "seed": 42,
      "primary": {
        "accuracy": 73.18519415655278
      },
      "secondary": {}
    },
    {
      "seed": 43,
      "primary": {
        "accuracy": 72.9075595739338
      },
      "secondary": {}
    },
    {
      "seed": 44,
      "primary": {
        "accuracy": 72.61416237205376
      },
      "secondary": {}
    },
    {
      "seed": 45,
      "primary": {
        "accuracy": 73.1431957175897
      },
      "secondary": {}
    },
    {
      "seed": 46,
      "primary": {
        "accuracy": 73.6498881798699
      },
      "secondary": {}
    }
  ],
  "aggregate": {
    "mean": {
      "accuracy": 73.1
    },
    "stdev": {
      "accuracy": 0.3822866865986972
    }
  },
  "task_score": 73.1,
  "rankable": true,
  "test_predictions_hash": "sha256:5658940322cd418f7f8813c80263a0a47eb9f1e7cfe029266c3af7d2b8a75f22",
  "sponsor": "Recrewty"
}