{
  "benchmark_name": "balkanbench",
  "benchmark_version": "0.1.0",
  "run_type": "official",
  "task_id": "superglue.rte.hr",
  "language": "hr",
  "model": "mmbert",
  "model_id": "jhu-clsp/mmBERT-base",
  "model_revision": "unknown",
  "code_revision": "unknown",
  "dataset_revision": "v0.1.0-data",
  "image_digest": "sha256:local",
  "config_hash": "sha256:1523e3421fc52040156929c3bc2a029e4a58cc6a243bed30ff78452ff54f397c",
  "selection_metric": "accuracy",
  "hp_search": {
    "tool": "optuna",
    "sampler": "TPESampler",
    "sampler_seed": 42,
    "num_trials": 20,
    "search_space_id": "default-binary_classification-v1",
    "early_stopping_policy": "patience=5 on accuracy",
    "best_trial_number": 6,
    "best_value": 0.7870036101083032,
    "sweep_id": "sweep-20260425-232449"
  },
  "seeds": [
    42,
    43,
    44,
    45,
    46
  ],
  "seed_results": [
    {
      "seed": 42,
      "primary": {
        "accuracy": 0.739
      },
      "secondary": {}
    },
    {
      "seed": 43,
      "primary": {
        "accuracy": 0.747
      },
      "secondary": {}
    },
    {
      "seed": 44,
      "primary": {
        "accuracy": 0.737
      },
      "secondary": {}
    },
    {
      "seed": 45,
      "primary": {
        "accuracy": 0.7406666666666667
      },
      "secondary": {}
    },
    {
      "seed": 46,
      "primary": {
        "accuracy": 0.727
      },
      "secondary": {}
    }
  ],
  "aggregate": {
    "mean": {
      "accuracy": 0.7381333333333333
    },
    "stdev": {
      "accuracy": 0.007263301973314595
    }
  },
  "task_score": 0.7381333333333333,
  "rankable": true,
  "test_predictions_hash": "sha256:b99b19ff11a1da3ae011f1f0152fac66265e4bb2638ba3f67e928bdd10e69013",
  "sponsor": "Recrewty"
}