{
  "benchmark_name": "balkanbench",
  "benchmark_version": "0.1.0",
  "run_type": "official",
  "task_id": "superglue.cb.hr",
  "language": "hr",
  "model": "mmbert",
  "model_id": "jhu-clsp/mmBERT-base",
  "model_revision": "unknown",
  "code_revision": "unknown",
  "dataset_revision": "v0.1.0-data",
  "image_digest": "sha256:local",
  "config_hash": "sha256:a96c3f78fec6a84429197345cf31a608e10f74afd40cd719640037eea45e79a5",
  "selection_metric": "f1_macro",
  "hp_search": {
    "tool": "optuna",
    "sampler": "TPESampler",
    "sampler_seed": 42,
    "num_trials": 20,
    "search_space_id": "default-multiclass_classification-v1",
    "early_stopping_policy": "patience=10 on f1_macro",
    "best_trial_number": 16,
    "best_value": 0.8789378057302586,
    "sweep_id": "sweep-20260425-232456"
  },
  "seeds": [
    42,
    43,
    44,
    45,
    46
  ],
  "seed_results": [
    {
      "seed": 42,
      "primary": {
        "f1_macro": 0.7377989866855191
      },
      "secondary": {
        "accuracy": 0.84
      }
    },
    {
      "seed": 43,
      "primary": {
        "f1_macro": 0.8101010023216072
      },
      "secondary": {
        "accuracy": 0.88
      }
    },
    {
      "seed": 44,
      "primary": {
        "f1_macro": 0.703925245436789
      },
      "secondary": {
        "accuracy": 0.796
      }
    },
    {
      "seed": 45,
      "primary": {
        "f1_macro": 0.816190764950329
      },
      "secondary": {
        "accuracy": 0.868
      }
    },
    {
      "seed": 46,
      "primary": {
        "f1_macro": 0.8307080466500757
      },
      "secondary": {
        "accuracy": 0.868
      }
    }
  ],
  "aggregate": {
    "mean": {
      "f1_macro": 0.779744809208864
    },
    "stdev": {
      "f1_macro": 0.05557678471818066
    }
  },
  "task_score": 0.779744809208864,
  "rankable": true,
  "test_predictions_hash": "sha256:c094ab5f6d2bdf82008864a841c6372f80b7134f3234d2c551bfad8d2660d288",
  "sponsor": "Recrewty"
}