{
  "benchmark_name": "balkanbench",
  "benchmark_version": "0.1.0",
  "run_type": "official",
  "task_id": "superglue.wsc.sr",
  "language": "sr",
  "model": "mmbert_small",
  "model_display_name": "mmBERT-small",
  "model_id": "jhu-clsp/mmBERT-small",
  "params": 140000000,
  "model_revision": "launch-seed-v0.1.0",
  "code_revision": "feature-code-for-eval-launch-seed",
  "dataset_revision": "v0.1.0-data",
  "image_digest": "sha256:0000000000000000000000000000000000000000000000000000000000000000",
  "config_hash": "sha256:3f1a704aa35560191fdbdd45c3eeac1ae7d4198a2c6d7128ff85e072b8891682",
  "selection_metric": "accuracy",
  "hp_search": {
    "tool": "optuna",
    "sampler": "TPESampler",
    "sampler_seed": 42,
    "num_trials": 0,
    "search_space_id": "v0.1-launch-seed",
    "early_stopping_policy": "reproduced from prior-pipeline aggregates; seeded for v0.1 launch, regenerated in v0.2 when all 9 models re-run through the public harness"
  },
  "seeds": [
    42,
    43,
    44,
    45,
    46
  ],
  "seed_results": [
    {
      "seed": 42,
      "primary": {
        "accuracy": 63.7484951343385
      },
      "secondary": {}
    },
    {
      "seed": 43,
      "primary": {
        "accuracy": 64.75539898587311
      },
      "secondary": {}
    },
    {
      "seed": 44,
      "primary": {
        "accuracy": 64.38076343001504
      },
      "secondary": {}
    },
    {
      "seed": 45,
      "primary": {
        "accuracy": 63.57830099766133
      },
      "secondary": {}
    },
    {
      "seed": 46,
      "primary": {
        "accuracy": 65.43704145211203
      },
      "secondary": {}
    }
  ],
  "aggregate": {
    "mean": {
      "accuracy": 64.38
    },
    "stdev": {
      "accuracy": 0.75825149169125
    }
  },
  "task_score": 64.38,
  "rankable": true,
  "test_predictions_hash": "sha256:d44488560c657088ca0bf04e9d199adbe1b3058bbb2ddd612fb112698640bef2",
  "sponsor": "Recrewty"
}