{
  "benchmark_name": "balkanbench",
  "benchmark_version": "0.1.0",
  "run_type": "official",
  "task_id": "superglue.rte.hr",
  "language": "hr",
  "model": "galton_v3_base",
  "model_id": "permitt/galton-bcms-v3-base-ctx8192",
  "model_revision": "unknown",
  "code_revision": "unknown",
  "dataset_revision": "v0.1.0-data",
  "image_digest": "sha256:local",
  "config_hash": "sha256:f0e2846dd99d0c50eaa1cb41894390bf09fce41b0c2fef7a9db89490e7fd641e",
  "selection_metric": "accuracy",
  "hp_search": {
    "tool": "optuna",
    "sampler": "TPESampler",
    "sampler_seed": 42,
    "num_trials": 20,
    "search_space_id": "default-binary_classification-v1",
    "early_stopping_policy": "patience=5 on accuracy",
    "best_trial_number": 13,
    "best_value": 0.7509025270758123,
    "sweep_id": "sweep-20260426-003310"
  },
  "seeds": [
    42,
    43,
    44,
    45,
    46
  ],
  "seed_results": [
    {
      "seed": 42,
      "primary": {
        "accuracy": 0.6926666666666667
      },
      "secondary": {}
    },
    {
      "seed": 43,
      "primary": {
        "accuracy": 0.7143333333333334
      },
      "secondary": {}
    },
    {
      "seed": 44,
      "primary": {
        "accuracy": 0.7073333333333334
      },
      "secondary": {}
    },
    {
      "seed": 45,
      "primary": {
        "accuracy": 0.7006666666666667
      },
      "secondary": {}
    },
    {
      "seed": 46,
      "primary": {
        "accuracy": 0.702
      },
      "secondary": {}
    }
  ],
  "aggregate": {
    "mean": {
      "accuracy": 0.7034
    },
    "stdev": {
      "accuracy": 0.008056743207469847
    }
  },
  "task_score": 0.7034,
  "rankable": true,
  "test_predictions_hash": "sha256:372a06b543d46947045dcc303ca9cdb65d973d1d236ddabc9a7b25f42da6452e",
  "sponsor": "Recrewty"
}