{
  "benchmark_name": "balkanbench",
  "benchmark_version": "0.1.0",
  "run_type": "official",
  "task_id": "superglue.multirc.sr",
  "language": "sr",
  "model": "modernbertic_base",
  "model_display_name": "ModernBERTi\u0107 base",
  "model_id": "permitt/galton-modernbertic-base-bcms-v1",
  "params": 395000000,
  "model_revision": "launch-seed-v0.1.0",
  "code_revision": "feature-code-for-eval-launch-seed",
  "dataset_revision": "v0.1.0-data",
  "image_digest": "sha256:0000000000000000000000000000000000000000000000000000000000000000",
  "config_hash": "sha256:b72b553deae1a34387915547e6e72a7ec6e7ef0f69dff5db019e1a56494074f2",
  "selection_metric": "f1_a",
  "hp_search": {
    "tool": "optuna",
    "sampler": "TPESampler",
    "sampler_seed": 42,
    "num_trials": 0,
    "search_space_id": "v0.1-launch-seed",
    "early_stopping_policy": "reproduced from prior-pipeline aggregates; seeded for v0.1 launch, regenerated in v0.2 when all 9 models re-run through the public harness"
  },
  "seeds": [
    42,
    43,
    44,
    45,
    46
  ],
  "seed_results": [
    {
      "seed": 42,
      "primary": {
        "f1_a": 67.71403040206862
      },
      "secondary": {}
    },
    {
      "seed": 43,
      "primary": {
        "f1_a": 67.86799332535786
      },
      "secondary": {}
    },
    {
      "seed": 44,
      "primary": {
        "f1_a": 67.61195120483075
      },
      "secondary": {}
    },
    {
      "seed": 45,
      "primary": {
        "f1_a": 68.37854966948635
      },
      "secondary": {}
    },
    {
      "seed": 46,
      "primary": {
        "f1_a": 67.9274753982564
      },
      "secondary": {}
    }
  ],
  "aggregate": {
    "mean": {
      "f1_a": 67.9
    },
    "stdev": {
      "f1_a": 0.2951041810317619
    }
  },
  "task_score": 67.9,
  "rankable": true,
  "test_predictions_hash": "sha256:5e4aa73cd6f6d25f89c05fc790f6bd66ec05200486a64dd0ba8bd3190a620d79",
  "sponsor": "Recrewty"
}