{
  "benchmark_name": "balkanbench",
  "benchmark_version": "0.1.0",
  "run_type": "official",
  "task_id": "superglue.rte.hr",
  "language": "hr",
  "model": "tesla_xlm",
  "model_id": "te-sla/teslaXLM",
  "model_revision": "unknown",
  "code_revision": "unknown",
  "dataset_revision": "v0.1.0-data",
  "image_digest": "sha256:local",
  "config_hash": "sha256:e547a881edfe87cd52383d699453e74cb9b2ea3a53e336d74c45df38cc935bac",
  "selection_metric": "accuracy",
  "hp_search": {
    "tool": "optuna",
    "sampler": "TPESampler",
    "sampler_seed": 42,
    "num_trials": 20,
    "search_space_id": "default-binary_classification-v1",
    "early_stopping_policy": "patience=5 on accuracy",
    "best_trial_number": 5,
    "best_value": 0.5487364620938628,
    "sweep_id": "sweep-20260425-232812"
  },
  "seeds": [
    42,
    43,
    44,
    45,
    46
  ],
  "seed_results": [
    {
      "seed": 42,
      "primary": {
        "accuracy": 0.49566666666666664
      },
      "secondary": {}
    },
    {
      "seed": 43,
      "primary": {
        "accuracy": 0.511
      },
      "secondary": {}
    },
    {
      "seed": 44,
      "primary": {
        "accuracy": 0.5126666666666667
      },
      "secondary": {}
    },
    {
      "seed": 45,
      "primary": {
        "accuracy": 0.496
      },
      "secondary": {}
    },
    {
      "seed": 46,
      "primary": {
        "accuracy": 0.49566666666666664
      },
      "secondary": {}
    }
  ],
  "aggregate": {
    "mean": {
      "accuracy": 0.5022
    },
    "stdev": {
      "accuracy": 0.008814760348415631
    }
  },
  "task_score": 0.5022,
  "rankable": true,
  "test_predictions_hash": "sha256:6fbede1d755f6bd763c682ec8e8b5df64643351f45be651c1d0662a9461aa677",
  "sponsor": "Recrewty"
}