{
  "benchmark_name": "balkanbench",
  "benchmark_version": "0.1.0",
  "run_type": "official",
  "task_id": "superglue.cb.hr",
  "language": "hr",
  "model": "mmbert_small",
  "model_id": "jhu-clsp/mmBERT-small",
  "model_revision": "unknown",
  "code_revision": "unknown",
  "dataset_revision": "v0.1.0-data",
  "image_digest": "sha256:local",
  "config_hash": "sha256:3756d9a731d84fc4f61103f8e9a1dc0adf9fc3a3952359c867651f4ee78eba60",
  "selection_metric": "f1_macro",
  "hp_search": {
    "tool": "optuna",
    "sampler": "TPESampler",
    "sampler_seed": 42,
    "num_trials": 20,
    "search_space_id": "default-multiclass_classification-v1",
    "early_stopping_policy": "patience=10 on f1_macro",
    "best_trial_number": 13,
    "best_value": 0.8145021645021645,
    "sweep_id": "sweep-20260425-232446"
  },
  "seeds": [
    42,
    43,
    44,
    45,
    46
  ],
  "seed_results": [
    {
      "seed": 42,
      "primary": {
        "f1_macro": 0.6724439572364233
      },
      "secondary": {
        "accuracy": 0.8
      }
    },
    {
      "seed": 43,
      "primary": {
        "f1_macro": 0.732527126464598
      },
      "secondary": {
        "accuracy": 0.82
      }
    },
    {
      "seed": 44,
      "primary": {
        "f1_macro": 0.7046937578550482
      },
      "secondary": {
        "accuracy": 0.768
      }
    },
    {
      "seed": 45,
      "primary": {
        "f1_macro": 0.5741071428571428
      },
      "secondary": {
        "accuracy": 0.74
      }
    },
    {
      "seed": 46,
      "primary": {
        "f1_macro": 0.7098506069094305
      },
      "secondary": {
        "accuracy": 0.764
      }
    }
  ],
  "aggregate": {
    "mean": {
      "f1_macro": 0.6787245182645286
    },
    "stdev": {
      "f1_macro": 0.06229405295116044
    }
  },
  "task_score": 0.6787245182645286,
  "rankable": true,
  "test_predictions_hash": "sha256:a2b4272e78a44c770cb245e87baa227145fbb7b701ea6633d9fcbf895a6e22e5",
  "sponsor": "Recrewty"
}