{
  "benchmark_name": "balkanbench",
  "benchmark_version": "0.1.0",
  "run_type": "official",
  "task_id": "superglue.copa.hr",
  "language": "hr",
  "model": "xlm_r_bertic",
  "model_id": "classla/xlm-r-bertic",
  "model_revision": "unknown",
  "code_revision": "unknown",
  "dataset_revision": "v0.1.0-data",
  "image_digest": "sha256:local",
  "config_hash": "sha256:d7b099424fdb237d3edab28d65c32964500bed0ce9fb3812dace55df2a6ee72c",
  "selection_metric": "accuracy",
  "hp_search": {
    "tool": "optuna",
    "sampler": "TPESampler",
    "sampler_seed": 42,
    "num_trials": 0,
    "search_space_id": "skip-hp-search",
    "early_stopping_policy": "patience=10 on accuracy"
  },
  "seeds": [
    42,
    43,
    44,
    45,
    46
  ],
  "seed_results": [
    {
      "seed": 42,
      "primary": {
        "accuracy": 0.516
      },
      "secondary": {}
    },
    {
      "seed": 43,
      "primary": {
        "accuracy": 0.568
      },
      "secondary": {}
    },
    {
      "seed": 44,
      "primary": {
        "accuracy": 0.556
      },
      "secondary": {}
    },
    {
      "seed": 45,
      "primary": {
        "accuracy": 0.524
      },
      "secondary": {}
    },
    {
      "seed": 46,
      "primary": {
        "accuracy": 0.518
      },
      "secondary": {}
    }
  ],
  "aggregate": {
    "mean": {
      "accuracy": 0.5364
    },
    "stdev": {
      "accuracy": 0.02393324048264253
    }
  },
  "task_score": 0.5364,
  "rankable": true,
  "test_predictions_hash": "sha256:61a677eb54fa5bbfbecca9315a24cb360896ab29ee592188854b2f5640b0f2f9",
  "sponsor": "Recrewty"
}